{
  "schema": "video-paper-wiki.paper-code-alignment.v1", "paper_id": "arxiv:2311.15127", "repository": "ExampleOrg/VideoModel", "commit": "aaaaaaaaaaaaaaaaaaaaaaaaaaaaaaaaaaaaaaaa",
  "officiality": {"status": "official", "evidence": [{"kind": "pdf", "source_id": "src-paper", "page": 12, "ref": "#/texts/42", "artifact_path": "sources/src-paper/paper.pdf", "artifact_sha256": "bbbbbbbbbbbbbbbbbbbbbbbbbbbbbbbbbbbbbbbbbbbbbbbbbbbbbbbbbbbbbbbb", "text_sha256": "cccccccccccccccccccccccccccccccccccccccccccccccccccccccccccccccc"}]},
  "license": {"spdx_id": "Apache-2.0", "notes": "Declared in LICENSE."}, "archived": false,
  "capabilities": [
    {"name": "training", "status": "present", "locators": [{"kind": "code", "source_id": "src-repo", "repository": "ExampleOrg/VideoModel", "commit": "aaaaaaaaaaaaaaaaaaaaaaaaaaaaaaaaaaaaaaaa", "path": "train.py", "lines": {"start": 10, "end": 30}, "symbol": "train", "snippet_sha256": "dddddddddddddddddddddddddddddddddddddddddddddddddddddddddddddddd"}]},
    {"name": "inference", "status": "present", "locators": []},
    {"name": "data", "status": "partial", "locators": []},
    {"name": "evaluation", "status": "absent", "locators": [], "absence_scope": {"commit": "aaaaaaaaaaaaaaaaaaaaaaaaaaaaaaaaaaaaaaaa", "tree_prefix": "", "search_patterns": ["eval", "benchmark"]}},
    {"name": "checkpoints", "status": "unverified", "locators": [], "checkpoint_kind": "link_only"}
  ]
}
